questions,answer,category
Bagaimana ruang laktasi/nursery room di Universitas Brawijaya mendukung kesejahteraan ibu yang bekerja atau belajar di kampus?,"Ruang laktasi merupakan fasilitas ruang yang diberikan kepada Ibu yang telah memiliki anak sehingga dapat meluangkan waktu di sela-sela pekerjaan bagi anaknya, mendukung kesejahteraan ibu yang bekerja atau belajar di kampus.",Sarana Prasarana
Apa peran Area Parkir di lingkungan kampus dalam mendukung mobilitas mahasiswa?,"Area parkir disiapkan di lahan yang luas sehingga dapat menampung kendaraan yang digunakan oleh mahasiswa, membantu mendukung mobilitas mahasiswa dengan menyediakan tempat parkir yang memadai.",Sarana Prasarana
Bagaimana Mahasiswa dapat mengakses layanan Layanan Disabilitas Universitas Brawijaya?,Informasi mengenai cara mahasiswa dapat mengakses Layanan Disabilitas Universitas Brawijaya tidak disebutkan dalam data.,Sarana Prasarana
Apa saja kegiatan yang dapat diikuti oleh mahasiswa di Mushola Ulul Al-Baab?,"Mahasiswa dapat mengikuti kegiatan seperti pengajian, kajian agama, keputrian, dan kegiatan agama lainnya yang sering diadakan di Mushola Ulul Al-Baab.",Sarana Prasarana
"Apakah terdapat fasilitas tambahan di EduTech selain sebagai lahan terbuka?
",Sejauh ini tidak ada.,Sarana Prasarana
Apakah Gazebo Koridor dapat digunakan oleh mahasiswa dari semua fakultas atau terbatas pada fakultas tertentu?,Informasi mengenai apakah Gazebo Koridor dapat digunakan oleh mahasiswa dari semua fakultas atau terbatas pada fakultas tertentu tidak disebutkan dalam data.,Sarana Prasarana
Bagaimana peran Klinik Universitas Brawijaya dalam mendukung kesehatan mahasiswa dan keluarganya?,"Klinik Universitas Brawijaya menyelenggarakan pelayanan kesehatan pada aktivitas akademik beserta keluarganya dan masyarakat umum, namun detail mengenai bagaimana klinik mendukung kesehatan mahasiswa tidak disebutkan dalam data.",Sarana Prasarana
Apakah Griya Brawijaya menyediakan fasilitas kantin untuk penghuninya?,"Iya, Griya Brawijaya dilengkapi dengan kantin sebagai salah satu fasilitas yang disediakan.",Sarana Prasarana
Apa manfaat dari adanya Ruang laktasi/nursery room di kampus?,Ruang laktasi/nursery room memberikan manfaat kepada ibu yang bekerja atau belajar di kampus dengan memberikan tempat yang nyaman untuk menyusui atau merawat anak di sela-sela aktivitas.,Sarana Prasarana
Apakah Mushola Ulul Al-Baab terbuka untuk semua mahasiswa atau terkhusus untuk mahasiswa Fakultas Ilmu Komputer?,"Iya, mushola dapat digunakan untuk siapapun selama jam operasional kuliah berlangsung.",Sarana Prasarana
Apakah UB Sport Center memiliki jam operasional tertentu atau dapat diakses setiap saat?,Data tidak memberikan informasi mengenai jam operasional UB Sport Center.,Sarana Prasarana
Bagaimana fasilitas Layanan Disabilitas Universitas Brawijaya mendukung penyandang disabilitas dalam kegiatan akademik?,"Layanan Disabilitas Universitas Brawijaya memberikan layanan bagi penyandang disabilitas di Universitas Brawijaya untuk mendukung kegiatan akademik mereka, namun detailnya tidak disebutkan dalam data.",Sarana Prasarana
Apa yang menjadi fokus kegiatan di Masjid Raden Patah?,"Masjid Raden Patah sering mengadakan kegiatan rutin seperti pengajian, kajian agama, pembinaan Qiroatul Quran, tahfids Quran, dan kegiatan lainnya, serta aktif mengadakan seminar atau ceramah dengan mengundang tokoh agama di Malang dan Indonesia.",Sarana Prasarana
Bagaimana mahasiswa dapat mengakses Griya Brawijaya jika membutuhkan akomodasi sementara?,Mahasiswa dapat mengakses Griya Brawijaya sebagai akomodasi sementara yang terletak di seberang Gedung G FILKOM.,Sarana Prasarana
Apa saja jenis pelayanan kesehatan yang biasanya disediakan oleh Klinik Universitas Brawijaya?,Data tidak memberikan informasi detail mengenai jenis pelayanan kesehatan yang disediakan oleh Klinik Universitas Brawijaya.,Sarana Prasarana
Bagaimana Mahasiswa dapat mengakses Layanan Disabilitas Universitas Brawijaya untuk mendapatkan dukungan?,Mahasiswa dapat langsung mengunjungi layanan disabilitas yang terletak disebelah Griya Brawijaya.,Sarana Prasarana
Apa kegiatan yang dapat diikuti oleh mahasiswa di Gazebo Koridor untuk bersantai dan belajar?,"Gazebo Koridor merupakan area luas yang dapat digunakan oleh mahasiswa untuk belajar, bersantai, dan berkoordinasi.",Sarana Prasarana
Bagaimana kondisi Area Parkir di Universitas Brawijaya selama jam-jam sibuk?,"Cukup penuh, namun FILKOM terus berupaya menghadirkan solusi termasuk akses parkir tambahan di tanah lapang sebelah gedung G.",Sarana Prasarana
Apakah Gazebo Koridor dapat digunakan untuk kegiatan kelompok mahasiswa?,Gazebo Koridor merupakan area luas yang dapat digunakan oleh mahasiswa ataupun kelompok mahasiswa.,Sarana Prasarana
Apa yang menjadi ciri khas dari Mushola Ulul Al-Baab di Fakultas Ilmu Komputer?,"Mushola Ulul Al-Baab terletak pada lingkungan Fakultas Ilmu Komputer dan sering mengadakan kegiatan seperti pengajian, kajian agama, keputrian, dan kegiatan agama lainnya.",Sarana Prasarana
Bagaimana peran Ruang laktasi/nursery room dalam mendukung perempuan yang bekerja atau belajar di kampus?,Ruang laktasi/nursery room memberikan dukungan kepada perempuan yang bekerja atau belajar di kampus dengan menyediakan fasilitas khusus untuk menyusui atau merawat anak di sela-sela aktivitas.,Sarana Prasarana
"Apakah terdapat kebijakan khusus untuk mengakses Layanan Disabilitas Universitas Brawijaya, dan bagaimana mahasiswa dapat memanfaatkannya?",Layanan Disabilitas UB ditujukan untuk memberikan layanan kepada sivitas akademika penyandang disabilitas di Universitas Brawijaya. Informasi mengenai kontak bisa diakses pada link berikut: https://pld.ub.ac.id/services/,Sarana Prasarana
Bagaimana UB Sport Center berkontribusi dalam mempromosikan gaya hidup sehat di kalangan mahasiswa?,"UB Sport Center dengan menyediakan berbagai cabang olahraga dan fasilitas, seperti ruangan loker, untuk menunjang sekaligus berkontribusi dalam mempromosikan gaya hidup sehat di kalangan mahasiswa.",Sarana Prasarana
Bagaimana peran Gazebo Koridor dalam mendukung aktivitas akademik mahasiswa di luar kelas?,"Gazebo Koridor dapat digunakan oleh mahasiswa untuk belajar, bersantai, dan berkoordinasi, sehingga mendukung aktivitas akademik di luar kelas.",Sarana Prasarana
Apakah Mushola Ulul Al-Baab membuka kesempatan bagi mahasiswa untuk berpartisipasi dalam kegiatan keagamaan?,"Iya, Mushola Ulul Al-Baab sering mengadakan kegiatan keagamaan seperti pengajian, kajian agama, keputrian, dan kegiatan agama lainnya yang dapat diikuti oleh mahasiswa.",Sarana Prasarana
Apakah terdapat layanan transportasi umum atau shuttle bus yang terhubung dengan Area Parkir di Universitas Brawijaya?,Terdapat sepeda listrik yang dapat disewa untuk di lingkungan Universitas Brawijaya,Sarana Prasarana
Bagaimana UB Sport Center menjaga keamanan pengunjung yang menggunakan fasilitas olahraga?,UB Sport Center dilengkapi dengan ruangan loker untuk keamanan dan kenyamanan pengunjung selama berolahraga.,Sarana Prasarana
Apakah Griya Brawijaya menyediakan fasilitas parkir untuk tamu dan penghuni?,Griya Brawijaya dilengkapi dengan tempat parkir sebagai salah satu fasilitas yang disediakan.,Sarana Prasarana
Bagaimana Masjid Raden Patah berkontribusi dalam mendukung keberagaman kegiatan keagamaan di lingkungan Universitas Brawijaya?,"Masjid Raden Patah (MRP) sering mengadakan kegiatan rutin seperti pengajian, kajian agama, pembinaan Qiroatul Quran, tahfids Quran, dan seminar atau ceramah, yang mendukung keberagaman kegiatan keagamaan di lingkungan Universitas Brawijaya.",Sarana Prasarana
Bagaimana peran Ruang laktasi/nursery room dalam mendukung perempuan yang bekerja atau belajar di kampus?,Ruang laktasi/nursery room memberikan dukungan kepada perempuan yang bekerja atau belajar di kampus dengan menyediakan fasilitas khusus untuk menyusui atau merawat anak di sela-sela aktivitas.,Sarana Prasarana
Bagaimana peran Layanan Disabilitas Universitas Brawijaya dalam memastikan aksesibilitas pendidikan bagi penyandang disabilitas?,Pusat Studi dan Layanan Disabilitas Universitas Brawijaya (PSLD UB) berfungsi sebagai pusat penelitian tentang isu-isu disabilitas dan memberikan layanan bagi penyandang disabilitas di Universitas Brawijaya untuk memastikan aksesibilitas pendidikan bagi mereka.,Sarana Prasarana
"Apakah terdapat fasilitas tambahan di Gazebo Koridor, seperti Wi-Fi atau colokan listrik, yang mendukung kegiatan mahasiswa?","Benar, terdapat fasilitas tambahan di Gazebo Koridor seperti Wi-Fi atau colokan listrik untuk menunjang aktifitas mahasiswa.",Sarana Prasarana
Bagaimana Klinik Universitas Brawijaya berkolaborasi dengan aktivitas akademik di universitas?,Klinik Universitas Brawijaya menyelenggarakan pelayanan kesehatan pada aktivitas akademik beserta keluarga.,Sarana Prasarana
Apakah Griya Brawijaya memberikan layanan khusus untuk tamu atau orang tua mahasiswa yang menginap sementara?,"Griya Brawijaya digunakan sebagai asrama untuk mahasiswa Universitas Brawijaya, para tamu, serta orang tua mahasiswa yang membutuhkan ruang menginap sementara.",Sarana Prasarana
Bagaimana peran Area Parkir dalam mendukung mobilitas mahasiswa di lingkungan kampus?,"Area parkir disiapkan di lahan yang luas sehingga dapat menampung kendaraan yang digunakan oleh mahasiswa, membantu mendukung mobilitas mahasiswa dengan menyediakan tempat parkir yang memadai.",Sarana Prasarana
Bagaimana Masjid Raden Patah berperan dalam mendukung kegiatan keagamaan di kalangan mahasiswa?,"Masjid Raden Patah (MRP) sering mengadakan kegiatan keagamaan seperti pengajian, kajian agama, pembinaan Qiroatul Quran, tahfids Quran, dan seminar atau ceramah, yang mendukung kegiatan keagamaan di kalangan mahasiswa.",Sarana Prasarana
Bagaimana peran Layanan Disabilitas Universitas Brawijaya dalam mempromosikan inklusivitas di lingkungan kampus?,"Pusat Studi dan Layanan Disabilitas Universitas Brawijaya (PSLD UB) berfungsi sebagai pusat penelitian tentang isu-isu disabilitas dan memberikan layanan bagi penyandang disabilitas di Universitas Brawijaya, yang dapat dianggap sebagai upaya mendukung inklusivitas.",Sarana Prasarana
Apa itu ELING?,ELING adalah Learning Management System yang digunakan oleh Fakultas Ilmu Komputer untuk menyelenggarakan pembelajaran.,Sarana Prasarana
Apa peran DPKA UB dalam Job Placement?,DPKA UB adalah portal informasi lowongan pekerjaan bagi alumni Universitas Brawijaya dan juga berfungsi sebagai portal utama untuk tracer study lulusan.,Sarana Prasarana
Apa itu Tracer Study dan bagaimana DPKA UB terlibat?,Tracer Study adalah kegiatan untuk melacak jejak karir lulusan. DPKA UB menyelenggarakan tracer study dan menyediakan informasi terkait.,Sarana Prasarana
Apa fungsi dari HaloFILKOM?,HaloFILKOM adalah platform ticketing yang digunakan untuk menyampaikan pertanyaan administratif dan dijawab oleh unit terkait.,Sarana Prasarana
Apa yang dimaksud dengan Panopto Video Platform?,"Panopto Video Platform adalah layanan online untuk menyimpan dan mengakses video, terutama yang berkaitan dengan pembelajaran.",Sarana Prasarana
Bagaimana video di Panopto digunakan dalam konteks pembelajaran?,"Video di Panopto umumnya merupakan komponen pembelajaran, menyediakan materi visual untuk mahasiswa.",Sarana Prasarana
Apa peran Portal Merdeka Belajar bagi mahasiswa?,Portal Merdeka Belajar berfungsi sebagai pusat informasi terkait lowongan dan hasil kegiatan merdeka belajar bagi mahasiswa.,Sarana Prasarana
Apa tujuan dari Web Perpustakaan Universitas Brawijaya?,Web Perpustakaan Universitas Brawijaya bertujuan untuk memberikan akses informasi ketersediaan buku guna mendukung pembelajaran.,Sarana Prasarana
Apa yang dapat ditemukan di Portal KKN?,Portal KKN menyediakan informasi terkait penyelenggaraan kegiatan KKN yang dilaksanakan setiap tahun sebagai amanah dari negara kepada penyelenggara pendidikan tinggi.,Sarana Prasarana
Apa manfaat media sosial FILKOM UB bagi mahasiswa?,Media sosial FILKOM UB membantu mahasiswa untuk lebih mudah menerima informasi terkini terkait dengan kegiatan dan perkembangan di fakultas.,Sarana Prasarana
Bagaimana alumni dapat mengakses informasi lowongan pekerjaan melalui DPKA UB?,Alumni dapat mengakses informasi lowongan pekerjaan melalui portal DPKA UB yang menyediakan database lowongan pekerjaan terbaru.,Sarana Prasarana
Apa jenis pertanyaan yang dapat diajukan melalui HaloFILKOM?,"HaloFILKOM dapat digunakan untuk menyampaikan pertanyaan seputar administratif, termasuk pertanyaan mengenai proses akademik dan administrasi fakultas.",Sarana Prasarana
Bagaimana akses terhadap video di Panopto diatur untuk mahasiswa?,"Akses terhadap video di Panopto umumnya diatur melalui platform pembelajaran, memastikan mahasiswa dapat mengakses materi sesuai dengan mata kuliah yang diikuti.",Sarana Prasarana
Apa informasi yang dapat ditemukan di Portal Merdeka Belajar selain lowongan?,"Portal Merdeka Belajar juga menyediakan informasi terkait kegiatan merdeka belajar, seperti hasil-hasil kegiatan dan proyek yang relevan.",Sarana Prasarana
Bagaimana mahasiswa dapat memanfaatkan Web Perpustakaan UB secara optimal?,"Mahasiswa dapat memanfaatkan Web Perpustakaan UB dengan mencari informasi ketersediaan buku, sumber referensi, dan layanan lain yang disediakan.",Sarana Prasarana
Apa peran Portal KKN dalam mendukung kegiatan KKN?,"Portal KKN berperan sebagai pusat informasi untuk mendukung penyelenggaraan kegiatan KKN, memberikan informasi terkait prosedur, lokasi, dan evaluasi kegiatan.",Sarana Prasarana
Apa jenis informasi yang sering dibagikan melalui media sosial FILKOM UB?,"Media sosial FILKOM UB seringkali membagikan informasi terkait acara-acara, prestasi mahasiswa, dan perkembangan terbaru di Fakultas Ilmu Komputer.",Sarana Prasarana
Apa manfaat bagi alumni yang berpartisipasi dalam Tracer Study melalui DPKA UB?,"Alumni yang berpartisipasi dalam Tracer Study melalui DPKA UB dapat mendapatkan wawasan tentang perkembangan karir alumni lain, mendukung jaringan profesional, dan memberikan masukan penting bagi perbaikan kurikulum.",Sarana Prasarana
Bagaimana respons waktu dalam menanggapi pertanyaan yang diajukan melalui HaloFILKOM?,"Respons waktu dalam menanggapi pertanyaan di HaloFILKOM biasanya cepat, dengan tujuan memberikan bantuan administratif secepat mungkin.",Sarana Prasarana
Apakah Panopto Video Platform hanya digunakan untuk materi pembelajaran formal?,"Tidak hanya untuk materi formal, Panopto juga dapat digunakan untuk merekam dan berbagi video aktivitas ekstrakurikuler, seminar, dan kegiatan kampus lainnya.",Sarana Prasarana
Apakah Portal Merdeka Belajar memiliki fitur pencarian pekerjaan untuk mahasiswa?,Portal Merdeka Belajar mungkin menyediakan fitur pencarian pekerjaan atau koneksi dengan perusahaan untuk memberikan opsi pekerjaan kepada mahasiswa.,Sarana Prasarana
Bagaimana cara akses sumber daya digital melalui Web Perpustakaan UB?,Mahasiswa dapat mengakses sumber daya digital melalui Web Perpustakaan UB dengan menggunakan akun perpustakaan mereka dan mengikuti panduan akses online yang disediakan.,Sarana Prasarana
Apakah Portal KKN juga menyediakan informasi bagi masyarakat yang ingin berpartisipasi dalam kegiatan KKN?,"Portal KKN mungkin menyediakan informasi bagi masyarakat yang ingin berpartisipasi dalam kegiatan KKN, termasuk cara bermitra dengan mahasiswa.",Sarana Prasarana
Bagaimana mahasiswa dapat berinteraksi melalui media sosial FILKOM UB?,"Mahasiswa dapat berinteraksi melalui media sosial FILKOM UB dengan memberikan komentar, menyukai, dan berbagi konten, serta berpartisipasi dalam event dan diskusi online.",Sarana Prasarana
Bagaimana alumni dapat memberikan umpan balik terhadap pengalaman mereka menggunakan DPKA UB?,Alumni dapat memberikan umpan balik melalui fitur yang disediakan di DPKA UB atau melalui survei kepuasan yang mungkin diadakan secara periodik.,Sarana Prasarana
Apakah HaloFILKOM juga digunakan untuk menyampaikan informasi umum kepada mahasiswa?,"Ya, HaloFILKOM bisa digunakan untuk menyampaikan informasi umum, pengumuman, dan berbagai pemberitahuan kepada mahasiswa.",Sarana Prasarana
Bagaimana akses ke video di Panopto diatur untuk dosen dalam konteks pengajaran?,Dosen biasanya memiliki hak akses penuh untuk mengelola dan membagikan video melalui Panopto sebagai bagian dari materi pengajaran mereka.,Sarana Prasarana
Bagaimana Portal Merdeka Belajar berkontribusi dalam mendukung program Merdeka Belajar?,"Portal Merdeka Belajar berkontribusi dengan menyediakan informasi tentang peluang-peluang belajar, pengembangan diri, dan kesempatan-kesempatan lain bagi mahasiswa.",Sarana Prasarana
Apakah Web Perpustakaan UB juga memberikan layanan konsultasi online untuk mahasiswa?,"Ya, Web Perpustakaan UB mungkin menyediakan layanan konsultasi online atau chat untuk membantu mahasiswa dalam mencari sumber informasi.",Sarana Prasarana
Apakah Portal KKN menyajikan laporan atau dokumentasi kegiatan KKN secara online?,"Ya, Portal KKN mungkin menyajikan laporan atau dokumentasi kegiatan KKN secara online untuk dapat diakses oleh semua pihak yang berkepentingan.",Sarana Prasarana
Bagaimana mahasiswa dapat berpartisipasi dalam kampanye atau event yang diadakan melalui media sosial FILKOM UB?,"Mahasiswa dapat berpartisipasi dengan mengikuti petunjuk atau undangan yang diumumkan melalui media sosial FILKOM UB, seperti menggunakan hashtag khusus atau mengirimkan kontribusi mereka.",Sarana Prasarana
Bagaimana DPKA UB mengelola dan menyajikan informasi lowongan pekerjaan kepada alumni?,DPKA UB dapat menggunakan platform online untuk menyajikan informasi lowongan pekerjaan dan memberikan akses kepada alumni untuk mengelola profil dan melamar pekerjaan.,Sarana Prasarana
"Apakah HaloFILKOM memiliki kategori pertanyaan tertentu, atau semua jenis pertanyaan dapat diajukan?","HaloFILKOM mungkin memiliki kategori pertanyaan tertentu, seperti administratif, akademis, atau teknis, namun sebagian besar pertanyaan dapat diajukan.",Sarana Prasarana
Bagaimana keamanan akses terhadap video di Panopto dijaga untuk melindungi materi pembelajaran?,"Keamanan akses di Panopto umumnya dijaga melalui pengaturan hak akses dan autentikasi yang ketat, memastikan hanya orang yang berhak dapat mengakses materi tersebut.",Sarana Prasarana
Bagaimana Portal Merdeka Belajar beradaptasi dengan perkembangan program Merdeka Belajar di tingkat nasional?,Portal Merdeka Belajar dapat mengikuti perkembangan program Merdeka Belajar nasional dengan menyediakan informasi terkini dan mendukung inisiatif-inisiatif yang sesuai.,Sarana Prasarana
Apakah Web Perpustakaan UB menyediakan akses ke jurnal dan artikel ilmiah online?,"Ya, Web Perpustakaan UB mungkin menyediakan akses ke jurnal dan artikel ilmiah online untuk mendukung kebutuhan penelitian mahasiswa dan dosen.",Sarana Prasarana
Apakah Portal KKN memberikan informasi tentang dampak positif dari kegiatan KKN di masyarakat?,"Ya, Portal KKN dapat memberikan informasi tentang dampak positif dari kegiatan KKN melalui laporan dan dokumentasi kegiatan.",Sarana Prasarana
Bagaimana mahasiswa dapat memberikan masukan atau ide melalui media sosial FILKOM UB?,"Mahasiswa dapat memberikan masukan atau ide dengan berpartisipasi dalam diskusi online, mengirimkan pesan langsung, atau berkontribusi dalam kampanye atau survei yang diadakan melalui media sosial FILKOM UB.",Sarana Prasarana
Bagaimana DPKA UB membantu mahasiswa dalam meningkatkan keterampilan mereka untuk meningkatkan peluang pekerjaan?,"DPKA UB dapat memberikan informasi tentang pelatihan dan kursus yang dapat meningkatkan keterampilan mahasiswa, sehingga meningkatkan daya saing mereka di pasar kerja.",Sarana Prasarana
Apakah HaloFILKOM memiliki sistem pelacakan tiket atau riwayat pertanyaan untuk memantau progres penyelesaian masalah?,"Ya, HaloFILKOM mungkin memiliki sistem pelacakan tiket atau riwayat pertanyaan untuk memantau progres dan memastikan penyelesaian yang efisien.",Sarana Prasarana
Apakah Panopto Video Platform mendukung fitur diskusi atau komentar pada video?,"Ya, Panopto Video Platform umumnya mendukung fitur diskusi atau komentar yang memungkinkan interaksi antara pengajar dan mahasiswa.",Sarana Prasarana
Bagaimana Portal Merdeka Belajar memfasilitasi akses mahasiswa terhadap informasi beasiswa atau program pengembangan diri?,Portal Merdeka Belajar dapat menyediakan kategori atau bagian khusus yang memuat informasi beasiswa dan program pengembangan diri untuk memudahkan akses mahasiswa.,Sarana Prasarana
Apakah Web Perpustakaan UB memiliki layanan peminjaman buku online?,"Ya, Web Perpustakaan UB mungkin menyediakan layanan peminjaman buku online yang memungkinkan mahasiswa untuk mengakses koleksi perpustakaan secara digital.",Sarana Prasarana
Bagaimana Portal KKN mendukung kolaborasi antara mahasiswa yang terlibat dalam kegiatan KKN?,"Portal KKN dapat menyediakan fitur kolaborasi online, seperti forum atau ruang diskusi, untuk memfasilitasi koordinasi dan pertukaran informasi antar mahasiswa yang terlibat dalam KKN.",Sarana Prasarana
Apakah media sosial FILKOM UB juga digunakan untuk mempromosikan kegiatan akademis atau proyek penelitian mahasiswa?,"Ya, media sosial FILKOM UB mungkin digunakan untuk mempromosikan kegiatan akademis, proyek penelitian, dan pencapaian mahasiswa guna meningkatkan visibilitas mereka.",Sarana Prasarana
Bagaimana mahasiswa dapat memberikan saran atau permintaan fitur terkait dengan ELING?,Mahasiswa dapat memberikan saran atau permintaan fitur melalui saluran resmi komunikasi fakultas atau melalui platform umpan balik yang mungkin disediakan di dalam ELING.,Sarana Prasarana
Bagaimana DPKA UB membantu mahasiswa yang sedang menjalani Tracer Study dalam mendapatkan data dan informasi?,"DPKA UB dapat membantu mahasiswa Tracer Study dengan menyediakan akses ke data dan informasi terkait jejak karir alumni, pengalaman kerja, dan pilihan karir.",Sarana Prasarana
Apakah HaloFILKOM memiliki fitur dukungan daring atau chat live untuk membantu mahasiswa yang memiliki pertanyaan mendesak?,"Ya, HaloFILKOM mungkin memiliki fitur dukungan daring atau chat live untuk memberikan bantuan langsung terhadap pertanyaan mendesak mahasiswa.",Sarana Prasarana
Bagaimana dosen dapat mengelola dan menyunting video yang diunggah ke Panopto?,"Dosen dapat menggunakan fitur pengelolaan Panopto untuk menyunting, mengelola, dan mengatur video yang diunggah ke platform tersebut.",Sarana Prasarana
Apakah Portal Merdeka Belajar memiliki integrasi dengan layanan penilaian dan pemetaan kemampuan mahasiswa?,Portal Merdeka Belajar mungkin memiliki integrasi dengan layanan penilaian untuk memetakan kemampuan mahasiswa dalam rangka mendukung program Merdeka Belajar.,Sarana Prasarana
Bagaimana mahasiswa dapat memberikan ulasan atau rekomendasi terkait koleksi buku dan layanan perpustakaan melalui Web Perpustakaan UB?,Mahasiswa biasanya dapat memberikan ulasan atau rekomendasi melalui formulir umpan balik yang mungkin disediakan di situs Web Perpustakaan UB.,Sarana Prasarana
Bagaimana Portal KKN mendukung dokumentasi dan publikasi hasil kegiatan KKN mahasiswa?,"Portal KKN dapat menyediakan fitur dokumentasi online dan berbagi hasil kegiatan KKN, termasuk publikasi laporan, foto, dan materi presentasi.",Sarana Prasarana
Apakah media sosial FILKOM UB digunakan untuk menjalin kemitraan dengan industri atau perusahaan untuk peluang pekerjaan atau kerja sama proyek?,"Ya, media sosial FILKOM UB mungkin digunakan untuk menjalin kemitraan dengan industri atau perusahaan, memfasilitasi peluang pekerjaan atau kerja sama proyek.",Sarana Prasarana
Apakah DPKA UB memberikan layanan konseling karir bagi mahasiswa yang mencari arah atau saran dalam membangun karir mereka?,"Ya, DPKA UB mungkin menyediakan layanan konseling karir yang membantu mahasiswa mendapatkan arah dan saran dalam membangun karir mereka.",Sarana Prasarana
Bagaimana mahasiswa dapat mengakses HaloFILKOM untuk menyampaikan pertanyaan atau permasalahan yang mereka hadapi?,"Mahasiswa dapat mengakses HaloFILKOM melalui portal online atau aplikasi khusus, kemudian menyampaikan pertanyaan atau permasalahan melalui formulir atau fitur yang disediakan.",Sarana Prasarana
Apakah Panopto Video Platform memiliki fitur penilaian atau kuis terintegrasi untuk menguji pemahaman mahasiswa?,"Ya, Panopto Video Platform mungkin memiliki fitur terintegrasi yang memungkinkan pengajar membuat kuis atau penilaian untuk menguji pemahaman mahasiswa terhadap materi video.",Sarana Prasarana
Bagaimana Portal Merdeka Belajar mendukung integrasi kegiatan ekstrakurikuler dan proyek pengembangan diri mahasiswa?,Portal Merdeka Belajar dapat menyediakan informasi dan dukungan untuk integrasi kegiatan ekstrakurikuler dan proyek pengembangan diri mahasiswa guna mendukung program Merdeka Belajar.,Sarana Prasarana
"Apakah Web Perpustakaan UB menyediakan layanan peminjaman buku fisik, atau fokusnya lebih pada sumber daya digital?","Web Perpustakaan UB mungkin menyediakan layanan peminjaman buku fisik dan sumber daya digital, memberikan pilihan kepada mahasiswa sesuai kebutuhan mereka.",Sarana Prasarana
Bagaimana Portal KKN membantu mahasiswa dalam merencanakan dan melaksanakan kegiatan KKN dengan efektif?,"Portal KKN dapat menyediakan panduan, formulir, dan informasi penting yang membantu mahasiswa merencanakan dan melaksanakan kegiatan KKN dengan efektif.",Sarana Prasarana
Apakah media sosial FILKOM UB juga digunakan untuk mendokumentasikan dan membagikan prestasi mahasiswa?,"Ya, media sosial FILKOM UB mungkin digunakan untuk mendokumentasikan dan membagikan prestasi mahasiswa, meningkatkan visibilitas pencapaian akademis mereka.",Sarana Prasarana
Bagaimana DPKA UB memastikan privasi informasi alumni terjaga saat digunakan untuk keperluan Tracer Study?,DPKA UB dapat menerapkan kebijakan privasi yang ketat dan langkah-langkah keamanan untuk memastikan privasi informasi alumni tetap terjaga saat digunakan untuk Tracer Study.,Sarana Prasarana
